<?xml version="1.0" encoding="UTF-8"?><?xml-stylesheet type="text/xsl" href="../../xsl/transversal/calendarioPlurianual.xsl"?><calendario xmlns:xsi="http://www.w3.org/2001/XMLSchema-instance" xsi:noNamespaceSchemaLocation="../../xsd/transversal/calendarioPlurianual.xsd">
    <ano valor="2025">
        <mes id_mes="9" nome="Setembro">
            <dia dia_semana="Segunda" numero="1">
                <util/>
            </dia>
            <dia dia_semana="Terca" numero="2">
                <util/>
            </dia>
            <dia dia_semana="Quarta" numero="3">
                <util/>
            </dia>
            <dia dia_semana="Quinta" numero="4">
                <util/>
            </dia>
            <dia dia_semana="Sexta" numero="5">
                <util/>
            </dia>
            <dia dia_semana="Sabado" numero="6">
                <fim-de-semana/>
            </dia>
            <dia dia_semana="Domingo" numero="7">
                <fim-de-semana/>
            </dia>
            <dia dia_semana="Segunda" numero="8">
                <util/>
            </dia>
            <dia dia_semana="Terca" numero="9">
                <util/>
            </dia>
            <dia dia_semana="Quarta" numero="10">
                <util/>
            </dia>
            <dia dia_semana="Quinta" numero="11">
                <util/>
            </dia>
            <dia dia_semana="Sexta" numero="12">
                <util/>
            </dia>
            <dia dia_semana="Sabado" numero="13">
                <fim-de-semana/>
            </dia>
            <dia dia_semana="Domingo" numero="14">
                <fim-de-semana/>
            </dia>
            <dia dia_semana="Segunda" numero="15">
                <util/>
            </dia>
            <dia dia_semana="Terca" numero="16">
                <util/>
            </dia>
            <dia dia_semana="Quarta" numero="17">
                <util/>
            </dia>
            <dia dia_semana="Quinta" numero="18">
                <util/>
            </dia>
            <dia dia_semana="Sexta" numero="19">
                <util/>
            </dia>
            <dia dia_semana="Sabado" numero="20">
                <fim-de-semana/>
            </dia>
            <dia dia_semana="Domingo" numero="21">
                <fim-de-semana/>
            </dia>
            <dia dia_semana="Segunda" numero="22">
                <util/>
            </dia>
            <dia dia_semana="Terca" numero="23">
                <util/>
            </dia>
            <dia dia_semana="Quarta" numero="24">
                <util/>
            </dia>
            <dia dia_semana="Quinta" numero="25">
                <util/>
            </dia>
            <dia dia_semana="Sexta" numero="26">
                <util/>
            </dia>
            <dia dia_semana="Sabado" numero="27">
                <fim-de-semana/>
            </dia>
            <dia dia_semana="Domingo" numero="28">
                <fim-de-semana/>
            </dia>
            <dia dia_semana="Segunda" numero="29">
                <util/>
            </dia>
            <dia dia_semana="Terca" numero="30">
                <util/>
            </dia>
        </mes>
        <mes id_mes="10" nome="Outubro">
            <dia dia_semana="Quarta" numero="1">
                <util/>
            </dia>
            <dia dia_semana="Quinta" numero="2">
                <util/>
            </dia>
            <dia dia_semana="Sexta" numero="3">
                <util/>
            </dia>
            <dia dia_semana="Sabado" numero="4">
                <fim-de-semana/>
            </dia>
            <dia dia_semana="Domingo" numero="5">
                <feriado>Implantação da República</feriado>
            </dia>
            <dia dia_semana="Segunda" numero="6">
                <util/>
            </dia>
            <dia dia_semana="Terca" numero="7">
                <util/>
            </dia>
            <dia dia_semana="Quarta" numero="8">
                <util/>
            </dia>
            <dia dia_semana="Quinta" numero="9">
                <util/>
            </dia>
            <dia dia_semana="Sexta" numero="10">
                <util/>
            </dia>
            <dia dia_semana="Sabado" numero="11">
                <fim-de-semana/>
            </dia>
            <dia dia_semana="Domingo" numero="12">
                <fim-de-semana/>
            </dia>
            <dia dia_semana="Segunda" numero="13">
                <util/>
            </dia>
            <dia dia_semana="Terca" numero="14">
                <util/>
            </dia>
            <dia dia_semana="Quarta" numero="15">
                <util/>
            </dia>
            <dia dia_semana="Quinta" numero="16">
                <util/>
            </dia>
            <dia dia_semana="Sexta" numero="17">
                <util/>
            </dia>
            <dia dia_semana="Sabado" numero="18">
                <fim-de-semana/>
            </dia>
            <dia dia_semana="Domingo" numero="19">
                <fim-de-semana/>
            </dia>
            <dia dia_semana="Segunda" numero="20">
                <util/>
            </dia>
            <dia dia_semana="Terca" numero="21">
                <util/>
            </dia>
            <dia dia_semana="Quarta" numero="22">
                <util/>
            </dia>
            <dia dia_semana="Quinta" numero="23">
                <util/>
            </dia>
            <dia dia_semana="Sexta" numero="24">
                <util/>
            </dia>
            <dia dia_semana="Sabado" numero="25">
                <fim-de-semana/>
            </dia>
            <dia dia_semana="Domingo" numero="26">
                <fim-de-semana/>
            </dia>
            <dia dia_semana="Segunda" numero="27">
                <util/>
            </dia>
            <dia dia_semana="Terca" numero="28">
                <util/>
            </dia>
            <dia dia_semana="Quarta" numero="29">
                <util/>
            </dia>
            <dia dia_semana="Quinta" numero="30">
                <util/>
            </dia>
            <dia dia_semana="Sexta" numero="31">
                <util/>
            </dia>
        </mes>
        <mes id_mes="11" nome="Novembro">
            <dia dia_semana="Sabado" numero="1">
                <feriado>Todos os Santos</feriado>
            </dia>
            <dia dia_semana="Domingo" numero="2">
                <fim-de-semana/>
            </dia>
            <dia dia_semana="Segunda" numero="3">
                <util/>
            </dia>
            <dia dia_semana="Terca" numero="4">
                <util/>
            </dia>
            <dia dia_semana="Quarta" numero="5">
                <util/>
            </dia>
            <dia dia_semana="Quinta" numero="6">
                <util/>
            </dia>
            <dia dia_semana="Sexta" numero="7">
                <util/>
            </dia>
            <dia dia_semana="Sabado" numero="8">
                <fim-de-semana/>
            </dia>
            <dia dia_semana="Domingo" numero="9">
                <fim-de-semana/>
            </dia>
            <dia dia_semana="Segunda" numero="10">
                <util/>
            </dia>
            <dia dia_semana="Terca" numero="11">
                <util/>
            </dia>
            <dia dia_semana="Quarta" numero="12">
                <util/>
            </dia>
            <dia dia_semana="Quinta" numero="13">
                <util/>
            </dia>
            <dia dia_semana="Sexta" numero="14">
                <util/>
            </dia>
            <dia dia_semana="Sabado" numero="15">
                <fim-de-semana/>
            </dia>
            <dia dia_semana="Domingo" numero="16">
                <fim-de-semana/>
            </dia>
            <dia dia_semana="Segunda" numero="17">
                <util/>
            </dia>
            <dia dia_semana="Terca" numero="18">
                <util/>
            </dia>
            <dia dia_semana="Quarta" numero="19">
                <util/>
            </dia>
            <dia dia_semana="Quinta" numero="20">
                <util/>
            </dia>
            <dia dia_semana="Sexta" numero="21">
                <util/>
            </dia>
            <dia dia_semana="Sabado" numero="22">
                <fim-de-semana/>
            </dia>
            <dia dia_semana="Domingo" numero="23">
                <fim-de-semana/>
            </dia>
            <dia dia_semana="Segunda" numero="24">
                <util/>
            </dia>
            <dia dia_semana="Terca" numero="25">
                <util/>
            </dia>
            <dia dia_semana="Quarta" numero="26">
                <util/>
            </dia>
            <dia dia_semana="Quinta" numero="27">
                <util/>
            </dia>
            <dia dia_semana="Sexta" numero="28">
                <util/>
            </dia>
            <dia dia_semana="Sabado" numero="29">
                <fim-de-semana/>
            </dia>
            <dia dia_semana="Domingo" numero="30">
                <fim-de-semana/>
            </dia>
        </mes>
        <mes id_mes="12" nome="Dezembro">
            <dia dia_semana="Segunda" numero="1">
                <feriado>Restauração da Independência</feriado>
            </dia>
            <dia dia_semana="Terca" numero="2">
                <util/>
            </dia>
            <dia dia_semana="Quarta" numero="3">
                <util/>
            </dia>
            <dia dia_semana="Quinta" numero="4">
                <util/>
            </dia>
            <dia dia_semana="Sexta" numero="5">
                <util/>
            </dia>
            <dia dia_semana="Sabado" numero="6">
                <fim-de-semana/>
            </dia>
            <dia dia_semana="Domingo" numero="7">
                <fim-de-semana/>
            </dia>
            <dia dia_semana="Segunda" numero="8">